,title,date,link,author,text
0,Vienna shooting: Gunman hunted after deadly 'terror' attack,"Tue, 03 Nov 2020 01:36:46 GMT",https://www.bbc.co.uk/news/world-europe-54786952,,"Gunmen armed with rifles have opened fire in six different locations in central Vienna, killing two people and wounding several more, police say. Austrian Chancellor Sebastian Kurz called it a ""repulsive terror attack"" and said one gunman was also killed. Police were searching for at least one attacker who was still at large, the interior minister said. The shootings took place near Vienna's central synagogue but it is not yet clear if that was the target. One of the victims was killed at the scene of the shootings while a second - a woman - died later in hospital from her wounds, Mayor Michael Ludwig said. It is believed 14 other people remain in hospital, six in a serious condition. A police officer is among the injured, the interior ministry said. In pictures: Scene of gun attack in Vienna The attack happened just hours before Austria imposed new national restrictions to try to stem rising cases of coronavirus. Many people were out enjoying bars and restaurants which are now closed until the end of November. European leaders strongly condemned the shooting. British Prime Minister Boris Johnson said he was ""deeply shocked by the terrible attacks"". Police said the incident began near the Seitenstettengasse synagogue, which is the main temple in Vienna. Jewish community leader Oskar Deutsch tweeted that the synagogue was closed at the time the attack began at 20:00 (19:00 GMT). An officer guarding the synagogue was among the wounded, newspaper Kronen Zeitung reported. It was not immediately clear how many attackers took part in the shooting. Austrian media said one person had been arrested, citing the interior ministry. Footage posted on social media showed people running through the streets as gunshots rang out.  Witness Chris Zhao was in a nearby restaurant when the shooting started. He told the BBC: ""We heard noises that sounded like firecrackers. We heard about 20 to 30 and we thought that to be actually gunfire. We saw the ambulances... lining up. There were victims. Sadly, we also saw a body lying down the street next to us."" As a major anti-terror operation swung into action, police urged people to avoid the area and not to use public transport. Roadblocks were set up around the city centre.  Police in the neighbouring Czech Republic said they had launched random checks on the border with Austria amid fears that the gunmen might head in that direction. On Twitter, Mr Kurz said ""we are experiencing difficult hours in our republic"".  ""Our police will act decisively against the perpetrators of this hideous terrorist attack. We will never allow ourselves to be intimidated by terrorism,"" he said. European leaders condemned the attack, with French President Emmanuel Macron saying that Europe must not ""give up"" in the face of attacks. ""We the French people share the shock and grief of the Austrian people, struck this evening by an attack in the heart of their capital, Vienna. After France, a friend of ours is attacked. This is our Europe. Our enemies must know who they are dealing with,"" he said. Three people died in a knife attack in a church in the French city of Nice last week in what Mr Macron said was an ""Islamist terrorist attack"". The UK prime minister also said the country's ""thoughts are with the people of Austria - we stand united with you against terror"" while Home Secretary Priti Patel said ""we stand ready to support in any way we can"". European Council President Charles Michel called it a cowardly act that violated life and human values. Dutch Prime Minister Mark Rutte called the shooting ""a heinous act"" and expressed ""solidarity"" with Austria. "
1,Covid-19: Liverpool to pilot city-wide coronavirus testing,"Tue, 03 Nov 2020 03:10:31 GMT",https://www.bbc.co.uk/news/health-54786130,,"People in Liverpool will be offered regular Covid-19 tests under the first trial of whole city testing in England. Everyone living or working in the city will be offered tests, whether or not they have symptoms, with follow-up tests every two weeks or so. Some will get new tests giving results within an hour which, if successful, could be rolled out to ""millions"" by Christmas, the government says. Liverpool has one of the highest rates of coronavirus deaths in England. The latest figures show the city recorded 1,754 cases in the week up to 30 October. The average area in England had 153.  Along with the surrounding region, Liverpool was the first part of England to go into tier three restrictions. The pilot aims to limit spread of the virus by identifying as many infected people as possible, and taking action to break chains of transmission. What are the challenges of mass testing?'We are hanging by a thread' - Liverpool doctorCoronavirus: How to get a Covid testCovid-19 tests to be offered to all Redcar residents On Monday, the UK recorded 18,950 new confirmed cases of coronavirus and 136 deaths within 28 days of a positive test. A rising number of cases in recent weeks prompted Prime Minister Boris Johnson to announce a national lockdown in England. MPs are set to vote on the plan on Wednesday,  Mr Johnson told the Commons there was ""no alternative"" but to introduce the lockdown - which is due to begin on Thursday - if the government was to stop the NHS from being overwhelmed. He also said ministers were planning a ""steady but massive expansion in the deployment of quick, turnaround tests"". The Liverpool pilot will start this week and will include a mix of existing swab tests and new lateral flow tests, which can provide a result within an hour without the need to use a lab. New test sites will be set up across the city, including in care homes, schools, universities and workplaces. People will be able to book online, turn up in person, or wait for an invitation from the local authority. Around 2,000 military personnel will help plan the logistics and deliver tests. Announcing the pilot, Mr Johnson said: ""These tests will help identify the many thousands of people in the city who don't have symptoms but can still infect others without knowing.  ""Dependent on their success in Liverpool, we will aim to distribute millions of these new rapid tests between now and Christmas and empower local communities to use them to drive down transmission in their areas. ""It is early days, but this kind of mass testing has the potential to be a powerful new weapon in our fight against Covid-19.""  You can spread coronavirus before you even feel sick. That's why testing everyone - symptoms or not - can be such as powerful tool for getting on top of the virus.   China has shown it is possible to test entire cities of millions of people. However, there are questions with both the tests used and the strategy as a whole.   Rapid or ""lateral flow"" tests need high levels of the virus in the body in order to work. It is not yet clear how good they are at catching people in the early stages of the infection when the virus is still taking hold.   False positives - when you don't have the virus, but the test says you do - are also a bigger problem when you test large numbers of people. One analysis suggested a twice-a-week test for six months using a test with a 1% false positive rate would lead to more than 40% of people being wrongly told they had the virus. But even a perfect test cannot change the course of Covid on its own. There is already an issue with too few people fully isolating even when they have Covid symptoms and have tested positive.  Will people isolate when they have no symptoms at all or will they even come forward for testing if it might mean missing work and pay? The UK's first attempt at city-wide testing will help find the answers.  Liverpool's city mayor Joe Anderson told the Liverpool Echo mass testing could be a ""game-changer"" for the city. He said local leaders had been working with the government on the plan, adding: ""If this goes well, it could enable us to have some semblance of a normal Christmas here in Liverpool."" Former Health Secretary Jeremy Hunt told BBC Newsnight that ministers should set a target date in 2021 for achieving regular testing of the whole population. ""We know then, if we do that, we can control this virus - and that is the hope that people up and down the country want,"" he said.  ""They feel a lot of despair at the moment because they can't see light at the end of the tunnel."" The national lockdown in England will last until 2 December. Elsewhere in the UK, a new five-level system of coronavirus restrictions came into force in Scotland on Monday. In Wales, First Minister Mark Drakeford has said two households in Wales will be able to form a bubble and meet at home after the 17-day firebreak ends on 9 November. Schools in Northern Ireland have reopened after an extended half-term break, while other restrictions including the closure of pubs, bars and restaurants continue until 13 November. PAY-PACKET SUPPORT: What do chancellor's plans mean for wages?SUPPORT BUBBLES: What are they and who can be in yours?THE R NUMBER: What it means and why it mattersTEST AND TRACE: How does it work? LACKING MOTIVATION?: 6 hours of dance hits to help you stay energised all day longTHE NAKED SCIENTISTS: Why are people catching coronavirus on purpose? "
2,US Election 2020: Biden and Trump make final pitches to voters,"Tue, 03 Nov 2020 02:37:44 GMT",https://www.bbc.co.uk/news/election-us-2020-54787441,,"US President Donald Trump and his Democratic challenger Joe Biden have spent the final hours of the White House race delivering their closing pitch to voters in critical states. Mr Biden campaigned in Pennsylvania and Ohio, as Mr Trump toured the voting battlegrounds of Wisconsin, Michigan, North Carolina and Pennsylvania.   National polls suggest a firm lead for Mr Biden in Tuesday's election. But his lead is narrower in the handful of states that could decide the result. More than 98 million people have already cast their ballots in early voting, putting the country on course for its highest turnout in a century.  US election 2020: A really simple guideUS businesses brace for election unrest In the US election, voters decide state-level contests rather than an overall single national one.  To be elected president, a candidate must win at least 270 votes in what is called the electoral college. Each US state gets a certain number of votes partly based on its population and there are a total of 538 up for grabs. This system explains why it is possible for a candidate to win the most votes nationally - like Hillary Clinton did in 2016 - but still lose the election. Tuesday's vote comes amid the ongoing coronavirus pandemic. The US has recorded more cases and more deaths than any other country worldwide, reporting more than 81,000 new infections on Sunday alone.   Top virus expert Anthony Fauci has sharply criticised the Trump administration's handling of the pandemic, drawing a rebuke from the White House on Sunday. As the nation counts down the hours to the vote, there are fears that pockets of post-election violence could break out. Businesses in the nation's capital, Washington DC, and in New York City have been seen boarding up their premises due to concerns about unrest. Meanwhile, the FBI says it is investigating after a convoy of vehicles with Donald Trump flags surrounded a bus carrying Mr Biden's campaign staff on a Texas highway last week. After a punishing schedule of rallies in six states on Sunday, President Trump was sprinting through four more battleground states on Monday. In North Carolina, he told supporters that ""next year will be the greatest economic year in the history of our country"". The rally was postponed from Thursday due to Hurricane Zeta.  He touted numbers that he says ""nobody even thought possible"". The US economy saw record-breaking 33% growth in the third financial quarter of this year, following a record 31% contraction in the second. But economists warn the damage inflicted by the pandemic - the biggest decline in the US economy in more than 80 years - could still take years to overcome. After North Carolina, Mr Trump headed to Scranton, Pennsylvania, the city where his opponent lived until he was 10. At a rally there he reminded his supporters that he won the state in 2016 despite polls suggesting he would lose.  The economy under Trump in six chartsFact-checking the closing days of the US electionTrump is in the fight of his political life Mr Biden also went to Pennsylvania where he was joined by singer Lady Gaga at a rally in Pittsburgh. Musician John Legend addressed voters with vice-presidential candidate Kamala Harris. Where Trump and Biden stand on guns, race and climateThe women who hold the key to Trump's survival At a last-minute campaign stop in Ohio, Mr Biden repeated the core message of his campaign, telling voters that the race was about the soul of America. He said it was time for Mr Trump to ""pack his bags"", saying ""we're done with the tweets, the anger, the hate, the failure, the irresponsibility"". The race in Ohio is extremely tight. In 2016, Mr Trump won by more than eight points - currently, he has a 0.2% lead over Mr Biden, according to an aggregate of polls by RealClearPolitics. Also on Monday's itinerary for Mr Trump were rallies in Traverse City, Michigan, and Kenosha, Wisconsin. Kenosha was rocked by violent protests in August after the police shooting of a black man. In Traverse City he asked for the votes of black Americans. The great dividing line of US electionWhy racism is still a problem for the world's most powerful country His last rally of the campaign is due to be held in Grand Rapids, Michigan, before midnight. On Sunday the candidates attacked each other on two of this campaign's key themes - Covid-19 and racial tension. The president and his campaign have meanwhile indicated they will sue to block the potentially pivotal state of Pennsylvania from counting postal ballots received three days after the election. The US Supreme Court allowed a lower court ruling granting the extended deadline to stand, but several conservative justices signalled they might be open to revisiting the issue after the vote. Mr Trump tweeted on Monday that the high court decision allowing ballots to be accepted three days after election day was ""a very dangerous one"".  ""It will allow rampant and unchecked cheating and will undermine our entire systems of laws. It will also induce violence in the streets. Something must be done!"" Twitter added a warning label that the tweet might contain ""misleading"" information. Legal fights over ballots have also been unfolding in Minnesota, North Carolina and Texas. Mr Biden has already vowed to stop President Trump ""stealing"" the election. President Trump is to host an election night party inside the White House with about 400 guests invited. Up to 10,000 protesters are meanwhile expected to gather at Black Lives Matter Plaza and a park not far from the White House, according to CBS News. Mr Biden and Ms Harris will watch the election night returns in the former vice-president's hometown of Wilmington, Delaware. It can take several days for every vote to be counted after any US presidential election, but it is usually pretty clear who the winner is by the early hours of the following morning. In 2016, Donald Trump took to the stage in New York at about 03:00 local time to give his victory speech in front of a crowd of jubilant supporters. What is the electoral college?How many Americans have voted early so far? But do not set your alarm clocks just yet. Officials are already warning that we may have to wait longer - possibly days, even weeks - for the result this year because of the expected surge in postal ballots. The last time the result was not clear within a few hours was in 2000, when the winner was not confirmed until a Supreme Court ruling was made a month later. Different states have different rules for how - and when - to count postal ballots, meaning there will be large gaps between them in terms of reporting results. In some states it will take weeks to get complete results. On Sunday, a report by news site Axios said Mr Trump would declare victory on Tuesday night if it looked as if he was ahead.  Mr Trump denied the report, but said that counting ballots after election day was a ""terrible thing"". Meanwhile, Mr Biden vowed to stop President Trump ""stealing"" the election. Who will be the next US president? You decideDo claims of US postal voting fraud stack up?Full coverage of the US election The two rivals have radically different policies on several key issues. On the coronavirus outbreak, Mr Trump set up a task force in January which he says has now shifted its focus to ""safety and opening up our country"". The president is also prioritising the speedy development of Covid treatments and vaccines, directing $10bn towards such projects. Mr Biden wants to set up a national contact-tracing programme, establish at least 10 testing centres in every state, and provide free coronavirus testing to all. He supports a nationwide mask mandate, which would require face coverings to be worn on federal property. What are Trump's and Biden's policies?What has Trump said about your country? On climate change, Mr Trump, being a sceptic, wants to expand non-renewable energy, and he has committed to withdrawing from the Paris Climate Accord.  Mr Biden says he would immediately re-join the Paris deal, and he also wants the US to reach net zero emissions by 2050. On the economy, Mr Trump has pledged to create 10 million jobs in 10 months, as well as one million new small businesses. He wants to deliver an income tax cut, and provide companies with tax credits to incentivise them to keep jobs in the US. Mr Biden wants to raise taxes for high earners to pay for investment in public services, but says the increase will only impact those earning over $400,000 a year. He supports raising the federal minimum wage to $15. Could TikTok influence the election result?: How the app and its users are changing US politicsUS election: Facts or fiction?: Exploring the candidates' claims during the campaign "
3,Universities and colleges face Covid funding shortfalls,"Tue, 03 Nov 2020 01:01:24 GMT",https://www.bbc.co.uk/news/education-54780790,,"Universities and colleges in England face ""significant funding shortfalls and heightened uncertainty"" due to the Covid-19 pandemic, a report warns. The Institute for Fiscal Studies says fewer overseas students, potentially higher dropouts and high pension costs are a financial risk for universities. Further education colleges still face budget pressures, despite a £400m cash boost, says the report. In July ministers said universities could apply for emergency loans. The IFS report on education spending in England, which was funded by  the Nuffield Foundation, warns that universities could be exposed to a range of financial losses, such as falling international student numbers and more students failing to complete their degrees. ""By far the largest source of financial risk for universities is pension costs,"" it says.  ""New figures suggest the additional cost to universities of meeting existing pension promises may well be as high as £8bn, or double our previous estimate of around £4bn.""  Colleges' financial health 'fragile', say auditorsEmergency loans for universities about to go bustCan I get a refund from my university this year?More students say university not value for money Universities could only reduce this by ""taking on more risk, making further reductions in the pensions provided by the scheme, big rises in employees' contributions"" or a combination of these. But such measures are likely to be controversial - last academic year, lecturers went on strike over pensions, as well as pay and conditions. The IFS also says student numbers in further education colleges and sixth forms are likely to increase this year, partly due to rising numbers of young people and partly due to ""unusually high GCSE results"" and significant reductions in training and employment opportunities. While England's colleges and sixth forms will receive an extra £400m this year,  ""exceptional rises in student numbers could still generate a real-terms fall in funding per student"". They will also face challenges around educational catch-up, but may also ""need to expand to accommodate extra students as apprenticeship and employment opportunities dry up"", the IFS says.  The report also raises concerns about early years provision, saying settings are likely to be ""much more financially exposed, both to the second lockdown and more broadly to a rather slow and incomplete return of demand for childcare"". While early years providers ""were financially well protected"" during the first lockdown by the government's commitment to continue to fund the free entitlement hours, a reassessment of this funding in January 2021 could prove problematic for providers. Report co-author Ben Waltmann said there had been speculation in the summer that universities would need a financial bailout.  ""In the end, student numbers have held up better than expected, but universities still face financial risks from no-shows or higher-than-usual dropout, as well as reductions in other income streams,"" he said.  ""By far the biggest source of risk now appears to be the large deficit on the main university pension scheme, which has increased from £3.6bn in March 2018 to a monumental £21.5bn in August 2020, according to the latest preliminary estimate.  ""With contributions already at more than 30% of earnings, it is hard to see how a deficit on this scale, if confirmed, could be evened out without further cuts in the generosity of the scheme."" Co-author Imran Tahir said the government had made transforming further education colleges a big priority, pledging  £400m in extra funding at the 2019 Spending Review. He said this could be ""the first real-terms increase in spending per student for about a decade"".  ""However, student numbers could have risen dramatically more than expected due to a reduction in training, apprenticeship and employment opportunities, on top of population growth.  ""If there is no additional funding forthcoming, planned real-terms increases in spending per student could be mostly - if not entirely - eroded."" Geoff Barton, head of the head teachers' union ASCL, said colleges were often ""treated by the government in terms of funding as a Cinderella service"".  Bill Watkin, chief executive of the Sixth Form Colleges Association, said the reduction in funding had led to ""courses being cut, support services reduced and extra-curricular activities removed for 16 to 18 year olds across the country"".  The £400m investment ""was a welcome step"", he said, ""but was only a one year deal following a decade of neglect."" "
4,US election: A wild three-year campaign in three minutes,"Mon, 02 Nov 2020 22:43:10 GMT",https://www.bbc.co.uk/news/election-us-2020-54772656,,"Billions of dollars spent, dozens of candidates, two nominees, one pandemic.What started with a little know congressman in the summer of 2017 ended as the most expensive US presidential election of all time. It featured 26 candidates for the Democratic Party nomination, the first black and Asian-American woman vice-presidential nominee, and some other historic firsts.Produced by Franz Strasser and Joaquim Salles  "
