,title,date,link,author,text
25,Inside the Johnny Depp court case,"Mon, 02 Nov 2020 17:05:17 GMT",https://www.bbc.co.uk/news/entertainment-arts-54506759,,"In May 2016, Amber Heard, a 30-year-old actress, arrived at a Los Angeles court seeking a restraining order against her husband, the Hollywood star Johnny Depp. As she left the building, she found herself surrounded by photographers, journalists and film crews. On her cheek was what appeared to be a mark. The court was also shown photographs of what looked like facial bruising. She said Depp had ""violently"" attacked her and in a rage had thrown a mobile phone at her face with ""extreme force"". There were also allegations of other incidents of domestic violence. She said she had endured ""excessive emotional, verbal and physical abuse"" and ""angry, hostile, humiliating and threatening assaults"". Depp denied the abuse. The restraining order was granted, and soon after the marriage was over. Four years later the couple were back in court, but this time in London. However, this was not Amber Heard's case - she had not chosen to be here. This was a libel action Depp had brought against a British newspaper, The Sun. At the heart of the case was his assertion that the allegations of physical abuse were an ""elaborate hoax"". Depp employed one of the best-known libel barristers in the country to try to prove the claims were untrue. Over the next three weeks, Heard arrived at court each day and walked past her former husband's fans, who were convinced that it was their hero who was the victim and it was she who had assaulted him. In court her story, photos, memories and the accounts of her friends were all exposed to the world and said by Depp's team and supporters to be part of a plot to falsely prove that he was, as The Sun had claimed in April 2018, a ""wife beater"". It was not just the fans and media who were watching carefully. Lawyers were already wondering, if he won, what impact this would have on women coming forward with claims of domestic violence. Outside, Johnny Depp would arrive each day to cheers. But his behaviour and lifestyle were also under the microscope - and a judge has now ruled that The Sun's allegations were ""substantially true"". Depp loses 'wife-beater' libel case again The Sun ""Would you like a Johnny Depp face mask?"" A woman holding a cardboard box offered me a small brown envelope. Inside was a black-and-white bandana and personal note of thanks from Johnny Depp. The woman, who was part of the actor's entourage, disappeared into court as all around me fans and onlookers began to inspect their new scarves. This was a strange court case. The rest of Britain was in lockdown, buses and streets in central London were deserted, and yet here, outside the Royal Courts of Justice, there was a crowd, sometimes more than 200 strong. Some wore masks but when Johnny Depp arrived, all attempts at social distancing collapsed in the crush to catch a glimpse.  Inside the High Court, it was even more peculiar. The Royal Courts of Justice are huge, gothic and deeply solemn. It's a place of stone arches and hushed tones. And in July it was almost empty. I say almost, because there were a few people - a handful of journalists hurrying through security, and also lingering in the hallways and passages a scattering of Depp fans.   One woman showed me her arms, which were covered in tattoos of Johnny Depp. Another man arrived each day dressed as Jack Sparrow, the star's character in Pirates of the Caribbean.   And then at around 10:00 each day they would gather at the door to Court 13. As Depp walked past they would offer messages of support and, towards the end of the case, he was seen giving them all a hug. A little chant of ""Johnny, Johnny"" could be heard as he walked into court. Ten minutes later, he was sitting in the witness stand trying to convince a High Court judge he was not a ""wife beater"". The accusations were shocking. Heard said she had been assaulted by him on more than 14 occasions. She said she had, at times, been in fear for her life and left with a broken nose, black eyes and split lip. Vicious, drunken tirades had, she said, lasted for days. There was also a 15th allegation too traumatic and personal to be heard in open court.   It felt like a criminal trial; Depp was being accused of repeated assaults on his former partner, the sort of violence that has sent others to prison. But this wasn't a criminal trial. It was easy to forget this was a libel battle between Depp and News Group Newspapers, the publishers of The Sun, because no-one from the newspaper was called to the witness stand. Dan Wootton, the journalist whose article had said there was ""overwhelming evidence"" that the actor was a ""wife beater"" was not even on the list of 79 names cited in the trial's documents. And what a list of names it was. The case began with an email exchange about the perils of addiction between Depp and Sir Elton John and then continued with references to a bewildering cast of characters. James Franco, Marilyn Manson, Elon Musk, Winona Ryder, Kate Moss and Vanessa Paradis were all guest stars in a story that took a private world of the Hollywood A-list and blew it apart.   We were shown text messages and video footage of meetings in lifts. The super-rich spend millions protecting their privacy and here was a couple revealing a telephone directory's worth of secrets. No star would do this unless they felt there was something bigger at stake. For Depp, that was restoring his reputation. But why did this battle begin in the UK? The article with the Dan Wootton byline, in particular the phrase ""wife beater"" in a headline that was later changed, had given Johnny Depp a chance to test his ex-wife's claims in court - and what's more, an English court.     What is libel and how does it work? It would require a much longer article to explain all the differences, but the essence of the legal split between England and America is that if you write something defamatory in London, the burden is on you to prove it is true.   In America, the defamed person has to prove it isn't true, a very different task. It sounds a slender legal nicety but it can make all the difference.   England and Wales's libel law was tightened in 2013, but it is still one of the best places in the world for the rich (and it is a rich person's game) to take on the media. If you want to win a libel case and you have a choice about where to bring it, lawyers will suggest buying a ticket to Heathrow.   And if you want to understand how big an issue this was for Depp's reputation, look at what he was trading. He lived in a world of security guards and private planes. Going to court blew it apart. If you ever wondered what it was like to be Depp, this case lifted the lid on his privileged but erratic existence, his temper and his history with drink and drugs.  Amber Heard was 22 when she met Johnny Depp on the set of the film The Rum Diary in 2009. He was 23 years older and in a long-term relationship with singer and actress Vanessa Paradis. Heard's wife at the time was the artist Tasya Van Ree. Two years later, Heard was living with Depp in a penthouse in downtown LA, Depp having separated from Paradis, his partner of 14 years. Heard and Depp married in February 2015, and just over a year later it was over.    Since then, Amber Heard has become a vocal campaigner on the issue of domestic and sexual abuse. The UN Human Rights Campaign named her as a Human Rights Champion for her work promoting women's rights. She became an Ambassador for Women's Rights for the American Civil Liberties Union (ACLU) and she has given speeches and written in the Washington Post and New York Times about her experience of domestic violence.    In the era of Me Too, she was a leading figure, speaking up for women who had suffered in silence by revealing the abuse she had endured at the hands of one of the most powerful people in Hollywood. She was Amber Heard, actor, model, activist and domestic abuse survivor. When Johnny Depp described her accusations as a hoax, he was not just challenging her story, he was ripping away the foundations of her public profile. There was a lot at stake here.  The entire process, which involved an almost brutal public examination of a couple's private life, has been a warning to anyone who wants to use the courts to restore a reputation.   It was clearly a deeply troubled relationship, but the case depended on proving who had done what to whom. And in the end, the judge decided it was true to describe Depp as a ""wife beater"". Information and support: If you, or someone you know, have been affected by domestic abuse, the following organisations may be able to help. "
26,Undercover Policing Inquiry: 'We want answers',"Mon, 02 Nov 2020 12:19:02 GMT",https://www.bbc.co.uk/news/uk-54780630,,"A long-delayed inquiry into abuses in undercover policing operations dating stretching over four decades is underway in London.  More than 200 members of the public are seeking answers as to what went on within controversial units targeting campaign groups.  Four people affected by the actions of the officers explain why they want to get at the truth. Interviewed by June Kelly and Dominic Casciani.  In 1997, Sukhdev Reel's 20-year-old son Ricky Reel was on a night out in Kingston-upon-Thames, south west London.  He and his friends were attacked and racially abused by two white men.  In the aftermath, Ricky disappeared and a week later his body was found in the River Thames.  The police said his death was probably an accident - but his family have always believed Ricky was murdered.  It's already emerged that the Metropolitan Police had an officer working undercover to gather information on the family campaign for justice for Stephen Lawrence, who was murdered in 1992.  Mrs Reel says she has been told that an officer who spied on the Lawrence campaign was also gathering intelligence on her fight for answers.  As the inquiry starts, the family and their supporters are launching a petition calling on the police to re-examine all the forensic evidence in Ricky's case using new technology.  Faith Mason's son, Neil Martin, was severely disabled, unable to walk and talk.  He died a month after his sixth birthday in 1969. Fifty years later it emerged that from the late 1980s, an undercover officer used Neil's first and middle names and his date of birth to create a fake identity.  Faith believes the officer may have travelled to County Durham, where the family live, and visited the cemetery where Neil is buried to look at the headstone on his grave. She is now unable to go there and wants to replace the headstone.  Kate Wilson was in her twenties and involved in campaigns for social justice when in 2003 she met a fellow activist, calling himself Mark Stone. They had an eighteen-month relationship and remained friends until 2010 - when he was unmasked as an undercover officer sent to infiltrate the environmental movement.  His real name was Mark Kennedy and he was married with children.  The truth was discovered by another activist who had been in a a six year relationship with Kennedy.  Kate has learned that a number of other people she regarded as friends have also turned out to be undercover police officers.  Shane Collins is a Green Party councillor in Froome, Somerset. For decades he's been involved in campaigns to protect the environment.  The network he was part of was infiltrated by Mark Kennedy and another undercover officer, Jim Boyling. In 2009, Cllr Collins and 113 others were arrested in Nottingham and held on suspicion of a plot to disrupt one of the country's most important coal-fired power stations.  Mark Kennedy later confessed to campaigners his role in setting up the action. Shane Collins wants to know how deep the infiltration went.  "
27,Gyms and coronavirus: What are the facts?,"Mon, 02 Nov 2020 14:07:17 GMT",https://www.bbc.co.uk/news/newsbeat-54540188,,"For the second time this year, gyms in England are closing their doors.  Some areas such as Liverpool had already turned off their treadmills, but now the rest of the country is following suit. It's after the government announced a second national lockdown, which means pubs, restaurants, non-essential shops and places of worship will also be closing on 5 November.  But what's the science behind shutting gyms?  Are they riskier than shopping or going to a restaurant? And what will it mean for the mental health of gym users? ""It's very difficult to know for sure where people get their virus,"" according to Professor Jonathan Ball, who's a virologist at the University of Nottingham.  He says gyms are closing because the government is trying to react to the high number of coronavirus cases.  ""When you've got such huge numbers of cases in the community, particularly in people who are young and healthy, they may not experience any symptoms at all.  ""There's always a risk that you might interact with someone who's infected [without either of you knowing] and that allows the virus to transmit."" Gyms might not be as high risk as hospitals or care homes but Prof Ball tells Newsbeat: ""You do tend to exercise quite vigorously, that means that you can breathe rapidly and quite deeply.  ""Therefore, we'd expect that you could potentially produce droplets or aerosols that could go on to infect other people."" He also points out there are lots of areas of gyms that people touch, like handles and equipment, before touching their faces. There is a big ""but"" though. Prof Ball says a lot of that risk can be dramatically lowered through things like effective air-conditioning, regular cleaning, social distancing and hand sanitising. ""From the data that I've seen from Public Health England, I'm not aware that there is a significant hotspot for infections in the gym environment. ""We know where the major risks are but after that we know there are other activities where people mix and where people mix, there is a chance of transmission occurring."" The only government data on gyms comes from Public Health England's surveillance report, which is based on data from Test and Trace. That data puts gyms on 2.8%, while supermarkets are 11.2%, pubs and bars are 7.4% and secondary schools are 6.8%.  What those percentages mean is a bit tricky - here's where they come from. In the week to 25 October, 107,046 people who had tested positive for coronavirus were referred for contact tracing. Of those, 33,233 had been somewhere in the previous seven days that at least one other person contacted had visited. About 930 of those said they had been to the gym - that's 2.8% of all the common locations reported. We don't know if they caught it at the gym - we just know they visited the gym. Is that a lot? It's hard to tell - you need to take into account how many people visit a gym regularly compared with, for example, a supermarket. The point is that for the latest week, gyms came sixth on the list of common locations, ahead of people attending universities, people working in care homes and people going shopping for clothes. And the government is bound to have noticed that. Its scientific advisory group Sage estimated in September that closing indoor gyms and leisure centres could potentially reduce the R number (that's the average number of people each infected person infects) by 0.1, but stressed that estimating that was ""very difficult"". Trainer Nathan Penman spoke to Newsbeat just before his gym closed in Liverpool in mid-October. Gyms in the Liverpool City Region closed earlier than the rets of the country, when the region went into tier three - the highest Covid alert level. ""It's just a bizarre feeling in the gym. It's the same kind of consensus among everybody there."" As well as working in a gym, Nathan says exercising is hugely important for his physical and mental health. ""Health and fitness, physically and mentally should be a priority for the nation at the minute. ""So for the government to turn around and say that gyms are not important - I think it's giving off a ridiculous message."" Nathan says people in the gyms he trains in have followed the rules. But 29-year-old Jack Occleshaw, from Nottingham, isn't as confident. ""You could tell that staff at the gym had put in all the measures to make you feel comfortable and were taking the situation seriously,"" he says.  ""But it was more the actual members that were not keeping up."" Jack was frustrated by members not wiping down equipment after use and thinks staff should have enforced the rules more strictly. ""I also tend to swim to help with mental health and clear my head. ""In our gym you have to book a slot. But you'd see people walk past the pool and say 'I reckon I could fit in there'."" Jack's concerns about people not following advice meant he was put off from using the gym. But this is no longer a choice he, or other gym users, will have.  As you'd expect, gyms aren't happy about being forced to close, with Anytime Fitness among those calling on the government to review its decision.  The chain says the announcement is ""difficult to take"" given people have been using gyms for the last four months.  It adds that if the government goes ahead with plans to shut gyms and leisure centres, then ""comprehensive financial support will be needed.""  Follow Newsbeat on Instagram, Facebook, Twitter and YouTube. Listen to Newsbeat live at 12:45 and 17:45 weekdays - or listen back here. "
28,Geneva: Why the world's highest minimum wage was needed,"Mon, 02 Nov 2020 00:03:18 GMT",https://www.bbc.co.uk/news/world-europe-54745033,,"Geneva is a very wealthy place. Home to a huge private banking sector, the United Nations, and auction houses Sotheby's and Christie's, which regularly sell enormous gemstones for eye-watering prices. And this month it is introducing the highest minimum monthly salary in the world, in response to a referendum at the end of September. The new hourly rate of 23 Swiss francs  - equivalent to £19, $25 or €22 - will give a minimum monthly salary of 4,000 francs (£3,350). This Swiss canton may be rich but it is also home to tens of thousands of hotel workers, waiters, cleaners and hairdressers who struggle to make ends meet. When Switzerland went into lockdown last March, images of lines of people at food banks in Geneva made headlines.  In fact, the food banks existed before the pandemic, and they are still there months after the lockdown ended. Charly Hernandez's charity Colis du Coeur distributes thousands of bags of groceries a week at one food bank in the city centre. The lines are long, most of the people queuing are women, many of them have young children. It may sound a lot, but only if you don't live in Geneva, Charly explains. ""A single room is 1,000 francs a month, if you can survive on 500 francs a month for food you're a very good manager, health insurance is 550 a month per person. If you are a family with two kids, you barely scrape by."" The new minimum wage will make a difference to many people, like Ingrid, who have been going to the food bank.  ""At the end of the month my pockets are empty,"" she says. ""This [food bank] has been great, because you have a week of food. A week of relief."" Even some of the volunteers, like Laura, find Geneva's cost of living difficult. On her nurse's salary, she can't really afford a place of her own in the city. ""I would be living in a very small place, in one room. So I still live with my family. I'm 26,"" she says. Businesses offering less than 23 francs an hour will now have to give employees a pay rise. To have to bear this new cost in the middle of the Covid pandemic and a drastic drop in profits could cause more harm than good, fears Vincent Subilia of Geneva's Chamber of Commerce.  ""Hotels, restaurants, these are areas which are already confronted with major challenges due to the pandemic,"" he says. ""This could potentially jeopardise the very existence of these sectors."" One restaurateur, Stefano Fanari, told Swiss television he did not think he would be able to foot the bill. As the head chef, his monthly wage averages between 5,000 and 6,000 francs a month. ""How can I continue when I have to pay the dish washers that much? ""Should I cut their hours? Don't get me wrong, I'm not against someone earning 4,000 a month. But there's a point where we just can't pay that. I've sacrificed, I work 12 hours a day here. What should I do?"" How high could the lowest wages go?Spain's minimum wage to jump 22% Geneva's minimum wage came into law not because the government imposed it, but because Geneva citizens proposed it as a ""people's initiative"". They gathered enough signatures to call a referendum on the issue, and on 27 September voters said yes, by a pretty overwhelming 58% to 42%. Switzerland's system of direct democracy means the voters have the final say, so the minimum wage is now obligatory.  Often, Swiss citizens tend to vote very cautiously when it comes to spending public money. But on the same day they also backed the nationwide introduction of two weeks' paid paternity leave.  For Charly Hernandez these moves are positive signs that, especially in such difficult times, people in this largely wealthy country are looking out for one another. ""They voted for it, and I'm elated. We do have a very direct democracy that is great, but what many people don't know is that most people's initiatives get turned down.  ""It's exceptional that things get approved, so I believe things are improving… OK at a slow pace, but that is the Swiss pace."" The next test for voters will come later this month when the Swiss will decide on a ""responsible business initiative"".  That would require companies based in Switzerland to take legal and financial responsibility for human rights and environmental abuses right along their supply chains, anywhere in the world.  A yes to that could cost far more than Geneva's world-beating minimum wage. More stories from our Switzerland correspondent Swiss firmly reject end to free movement with EUYearning for the sound of tourists in the Alps again "
29,Coronavirus: The big US election issue that could hurt Trump,"Sat, 31 Oct 2020 22:59:23 GMT",https://www.bbc.co.uk/news/election-us-2020-54754797,,"Just ahead of the presidential election, the US is seeing what could be the largest outbreak of the pandemic so far.How will that affect how Americans vote?Video by Angélica M Casas, additional filming by Alexandra Ostasiewicz and Joaquim Salles "
