,title,date,link,author,text
13,US election 2020: Trump and Biden pictured through the years,"Tue, 03 Nov 2020 00:14:37 GMT",https://www.bbc.co.uk/news/election-us-2020-54267454,,"President Donald Trump, 74, and Democratic challenger Joe Biden, 77, each have more than seven decades of personal and professional experience behind them. Here is a selection of photos that span their lives. Born in the wake of World War Two, in June 1946, Donald John Trump was the fourth child of New York real estate tycoon Fred Trump and Mary Anne MacLeod Trump. Despite the family's wealth, he was expected to do the most menial jobs within his father's company and was sent to a military academy at age 13 after he started misbehaving in school. He attended the University of Pennsylvania and became the favourite to succeed his father in the family business after his older brother, Fred, opted to become a pilot. Joseph Robinette Biden Jr was born in Scranton, Pennsylvania in 1942. He was the first of four children, in an Irish-American Catholic family. Young Joe's biggest challenge was overcoming a speech impediment - a stutter - that afflicted him well into high school. His technique of practising speaking in front of a mirror paid off after several months. Mr Biden attended the University of Delaware and then law school at Syracuse University. He later married his first wife, Neilia, and started his political career in Wilmington. Mr Trump says he got into the property business with a ""small"" $1m loan from his father, before joining Fred Trump's company. There, he helped manage an extensive portfolio of residential housing estates in New York City, eventually taking control of the company. In 1971, he renamed it the Trump Organization. Six years later, Donald Trump married his first wife, Ivana Zelnickova, a Czech athlete and model. His children from his first marriage - Donald Jr, Ivanka and Eric - now help run Trump Organization, though he is still chief executive. Joe Biden was eagerly waiting to take up his seat in the US Senate, having been elected in 1972, when tragedy struck. His wife and infant daughter Naomi were killed in a car accident. His sons Beau and Hunter were seriously injured. Mr Biden famously took the oath of office for his first term as a Democratic Party senator from the hospital room of his toddler sons. In the late 1970s Mr Trump stepped his ambitions up a gear, shifting his property focus from Brooklyn and Queens to glitzy Manhattan. After snapping up a rundown hotel and transforming it into the Grand Hyatt he built the most famous Trump property - the 68-storey Trump Tower on Fifth Avenue. It opened in 1983. Other properties bearing the famous name followed - Trump Place, Trump World Tower, Trump International Hotel and Tower - and his powerful brand began to draw media interest.  But not everything he touched turned to gold. Mr Trump's ventures have led to four business bankruptcy filings. During his first 14 years in Washington, Mr Biden rebuilt his personal life after the deaths of his wife and daughter. He committed to giving his sons a semblance of a normal life, and commuted each day from the family home in Delaware to Washington DC. He eventually remarried, to schoolteacher Jill Jacobs, with whom he had another child, Ashley. Mr Biden established himself on the Senate Judiciary Committee, and began to build a national profile. In 1987, he launched his first go at the US presidency, but withdrew after he was accused of plagiarising a speech by the then leader of the British Labour Party, Neil Kinnock. Property alone was not enough for Mr Trump, who moved into the entertainment sector, snapping up a clutch of beauty pageants in 1996: Miss Universe, Miss USA, and Miss Teen USA. In his personal life, after splitting with Ivana he married actress Marla Maples in 1993. They had a daughter, Tiffany, before divorcing in 1999 - the same year Mr Trump's father died. ""My father was my inspiration,"" Mr Trump said at the time. On 11 October 1991, the US public were glued to their TVs as Anita Hill, a law professor at the University of Oklahoma, testified before the Senate Judiciary Committee. The committee was holding a hearing into the nomination for the US Supreme Court of Clarence Thomas. Ms Hill alleged he had sexually harassed her on many occasions when they had both worked for the Reagan administration. As chairman of the committee, Joe Biden led the hearing. His handling of Ms Hill's evidence has long been criticised. The hearing was conducted by an all-white, all-male panel, and several women apparently willing to back up Ms Hill's account were not called by Mr Biden to testify. Speaking in a TV interview in April 2019, Mr Biden said that he was ""sorry for the way she got treated"". In 2003, Mr Trump fronted a new reality TV show that played to his reputations as both a businessman and a media personality. Called The Apprentice. the programme featured contestants competing for a shot at a management job in Mr Trump's commercial empire. He hosted the show for 14 seasons, and claimed in a financial disclosure form that he had been paid a total of $213m by the network during the show's run. Meanwhile, in 2005, he married his current wife, Melania Knauss, a Yugoslavian-born model. The couple have one son, Barron William Trump. Mr Biden had another shot at the presidency in 2008 before dropping out. But while his campaign had failed to break through, he was to reappear later that year in a role that assured him international prominence. On 23 August 2008, Mr Obama introduced Joe Biden as his vice-presidential running mate. It was a winning ticket and the pair eventually served two terms, establishing a close working relationship in which Mr Biden frequently called Mr Obama his ""brother"". It was not until June 2015 that Mr Trump formally announced his entrance into the race for the White House. His campaign for the presidency was rocked by controversies, including the emergence of a recording from 2005 of him making lewd remarks about women, and claims, including from members of his own party, that he was not fit for office. But he consistently told his army of supporters that he would defy the opinion polls, which mostly had him trailing his Democratic rival Hillary Clinton. He said his presidency would strike a blow against the political establishment and ""drain the swamp"" in Washington. He took inspiration from the successful campaign to get Britain out of the European Union, saying he would pull off ""Brexit times 10"". Despite almost all the predictions, Mr Trump was victorious in the 2016 election. He was inaugurated as the 45th US president on 20 January 2017. In a surprise ceremony in the final days of his presidency, Mr Obama awarded Mr Biden the Presidential Medal of Freedom - the nation's highest civilian honour. ""To know Joe Biden is to know love without pretence, services without self-regard and to live life fully,"" the then president said. It had been a successful partnership, but a period not without trauma for Mr Biden, whose son Beau died of brain cancer in 2015 at the age of 46. The younger Biden was seen as a rising star of US politics and had intended to run for Delaware state governor in 2016. Mr Trump's re-election campaign has been conducted against the backdrop of the coronavirus pandemic, in which 230,000 Americans have died, and seen the president himself become infected. First Lady Melania Trump and their son Barron caught the virus too, along with a number of staff at the White House. In the days before the election on 3 November, Trump urged states to shun lockdowns, whilst continuing his schedule of rallies in battleground states. The two presidential rivals' divisions over the coronavirus have been deep, with Mr Biden having said the president's handling of the worsening coronavirus crisis was an ""insult"" to its victims. ""Even if I win, it's going to take a lot of hard work to end this pandemic,"" he said. ""I do promise this - we will start on day one doing the right things."" More than 90 million Americans have voted early, many of them by post, in a record-breaking voting surge driven by the pandemic. Photos are subject to copyright. Who will be the next US president? You decideDo claims of US postal voting fraud stack up?Full coverage of the US election "
14,The Welsh community pulling together to feed families,"Tue, 03 Nov 2020 00:05:00 GMT",https://www.bbc.co.uk/news/uk-wales-54783783,,"Due to the economic impact of Covid-19, Panteg House social club in Pontypool has now become a distribution centre and food bank - and the hub of the local effort to feed those who've fallen on hard times. We spoke to food bank manager, Allan, as well as local teachers who are just some of the volunteers in a wider community effort.Video journalist: Alex Dackevych "
15,Coronavirus: Behind the scenes of developing a Covid-19 vaccine,"Tue, 03 Nov 2020 00:06:21 GMT",https://www.bbc.co.uk/news/science-environment-54783782,,"Ever wondered what scientists developing a Covid-19 vaccine do on a daily basis?Using the hashtag #TeamHalo, scientists are documenting their work on TikTok, Twitter and Instagram.Their aim is to bring the public closer to their work, and answer as many pressing questions as they can.It's a global effort, with scientists volunteering to post videos that highlight their efforts to curb the pandemic.Produced by Mattea Bubalo "
16,Bushfire koalas going back to the wild,"Tue, 03 Nov 2020 00:01:31 GMT",https://www.bbc.co.uk/news/world-australia-54786796,,"Australia’s peak bushfire season is rapidly approaching – with all eyes on whether the blazes will be anywhere near as bad as the devastation of last year.As well as claiming more than 30 lives and destroying thousands of homes – the country’s wildlife was also terribly hit. One of the worst-affected areas was Kangaroo Island in South Australia – a place renowned for its biodiversity and for one very Australian animal in particular, the koala.About 50,000 of the cuddly creatures lived there before the fires but it’s now feared as few as 5,000 are left.Bushfires bring 'apocalypse' to Kangaroo IslandVideo by Simon Atkinson "
17,Three elders give advice for Trump and Biden,"Tue, 03 Nov 2020 00:08:14 GMT",https://www.bbc.co.uk/news/world-54787675,,"What does it take to become a leader? From deep in the Maasai lands of Kenya to high in the mountains of Tibet, we talk to three traditional leaders on what they have learnt in their time as leaders of their communities.Stephen Oruma Ole Nkaru from Kenya, Ven. Gyetrul Jigme Rinpoche from Tibet and John Rice, Zahgausgai Mukwa from Wasauksing First Nation in Canada share their wisdom. "
18,'Living in America's cancer alley is like death row',"Mon, 02 Nov 2020 06:13:59 GMT",https://www.bbc.co.uk/news/newsbeat-54773957,,"“We are only fighting for fresh air,” Shamara Lavigne tells Radio 1 Newsbeat.The area around St. James in Louisiana, between New Orleans and Baton Rouge, has the undesirable nickname “cancer alley”.There are around 150 chemical plants located along this stretch of the Mississippi River. Data from the US Environmental Protection Agency suggests that those living in this area of Louisiana have the highest risk of getting cancer than anywhere in America.Now residents of the small, predominantly black, community known as the fifth district are campaigning to stop another large plant being built near their homes. But many feel let down by politicians. “I want them to stop saying yes to industry,” Sharon Lavigne tells Newsbeat, “if they can help us with that, they got my vote.”The plants provide a large number of jobs in the state, and the petrochemical companies disagree with the government report saying it’s based on faulty science.  Video by Matt Wareham and Daniel RosneyFollow Newsbeat on Instagram, Facebook, Twitter and YouTube.Listen to Newsbeat live at 12:45 and 17:45 weekdays - or listen back here. "
19,"All I want for Christmas is... 33,000 songs","Mon, 02 Nov 2020 12:32:53 GMT",https://www.bbc.co.uk/news/business-54779496,,"An investment company has bought a share of the rights to Mariah Carey's All I Want For Christmas Is You.  The inescapable festive tune was co-written by the singer with Walter Afanasieff, whose 50% stake has now been bought by fast-growing investment vehicle Hipgnosis Songs Fund. Its Christmas shopping basket did not stop with that barnstormer.  It bought 33,000 songs in a $323m (£250m) spree, including Fleetwood Mac's The Chain. It is the biggest buy yet for the fund, which lets people invest in hit songs. Can hit songs be worth more than gold?Why the Church of England co-owns a Beyoncé hit Founded by music industry veteran Merck Mercuriadis, Hipgnosis turns music royalties into an income stream. It has been listed on the London Stock Exchange since July 2018. Its latest deal covers songs previously owned by Kobalt Music Copyrights and written by more than 1,500 songwriters. Other successful tunes include: The Chain and Go Your Own Way by Fleetwood MacLet It Go by Demi Lovato (from Disney's Frozen soundtrack)Gimme Some Lovin' by the Spencer Davis GroupLove Shack by the B-52sIn Da Club by 50 CentSorry by Justin Bieber. ""These special songs that have had such extraordinary success have a lot more joy to bring the world and we look forward to working with these phenomenal creators in taking their songs to new heights while protecting their legacies,"" said Mr Mercuriadis. Before setting up Hipgnosis Songs Fund, Mr Mercuriadis managed artists including Beyoncé, Elton John, Iron Maiden and Guns N' Roses. In his view, songs are ""as investible as gold or oil"". Willard Ahdritz, founder and chairman of Kobalt and chief investment officer of Kobalt Capital Ltd, said: ""The decision to sell to Merck and Hipgnosis was an easy one as we know them so well and the copyrights will be well taken care of under a long-term administration arrangement with Kobalt Music Group."" "
20,Baby Shark becomes YouTube's most-watched video of all time,"Mon, 02 Nov 2020 15:30:22 GMT",https://www.bbc.co.uk/news/entertainment-arts-54783116,,"Baby Shark, the infuriatingly catchy children's rhyme recorded by South Korean company Pinkfong, has become the most-watched video ever on YouTube. The song has now been played 7.04 billion times, overtaking the previous record holder Despacito, the Latin pop smash by singer Luis Fonsi. Played back-to-back, that would mean Baby Shark has been streamed continuously for 30,187 years. Pinkfong stands to have made about $5.2m (£4m) from YouTube streams alone. It took four years for Baby Shark to ascend to the top of YouTube's most-played chart, but the song is actually much older than that. It is thought to have originated in US summer camps in the 1970s. One theory says it was invented in 1975, as Steven Spielberg's Jaws became an box office smash around the world. There are a huge number of variations on the basic premise, including one version where a surfer loses an arm to the shark, and another where the protagonist dies. There are also international versions - including the French Bebe Requin and the German Kleiner Hai (Little Shark), which became a minor hit in Europe in 2007. But none of them could match the phenomenal success of Pinkfong's interpretation, which was sung by 10-year-old Korean-American singer Hope Segoine and uploaded to YouTube in 2015. It's addictive ""doo doo doo doo doo doo"" hook and fishy dance moves became a craze in South Korea, where popular bands like Red Velvet, Girls' Generation and Blackpink started incorporating it into their concerts. The following June, Pinkfong put out a second video, titled Baby Shark Dance, featuring two cute kids performing the dance routine. That clip that inspired the hashtag #BabySharkChallenge - with everyone from Indonesian farmworkers to pop stars Cardi B and Josh Groban joining the fun. The song is catnip for children, whose appetite for repetition has undoubtedly helped it climb the ranks of YouTube's most-watched videos. ""Nursery rhymes have always been sort of slow, very cute, but something that would help your children fall asleep - as opposed to Baby Shark,"" Pinkfong's marketing director Jamie Oh told the BBC in 2018. ""Pinkfong's Baby Shark is very trendy and it has a very bright beat with fun dance moves. The animation is very vivid. We call it K-Pop for the next generation."" The company is turning the song into a movie and a musical, and aspires to make Baby Shark ""another classic for kids music, like Twinkle Twinkle Little Star"", Oh added. However, Pinkfong's parent company SmartStudy was sued last year by children's songwriter Jonathan Wright, who recorded a similar arrangement of the song in 2011 and argues that he owns the copyright to that interpretation. SmartStudy responded that their verison was ""based on a traditional sing-along chant which has passed to public domain"". The case is still under consideration by the Korea Copyright Commission. Last month, the song was at the centre of another controversy, when three prison workers in Oklahoma were accused of using it to punish inmates. According to court documents, five prisoners were handcuffed against a wall and forced to stand for two hours while listening to Baby Shark on repeat. Exposure to the song put ""undue emotional stress on the inmates who were most likely already suffering"", said district attorney David Prater. But the song has also been put to positive use.  When Eliane Jabbour unexpectedly found herself in the middle of an anti-government demonstration in Lebanon last October, she was concerned the commotion would scare her 15-month-old son, who had just woken from a nap in the passenger seat of her car. Instead, the protestors circled her car and sang Baby Shark to help calm the toddler down.  A video of the episode in Beirut - with Robin staring wide-eyed at the singing and dancing - itself went viral, and became a symbol of hope amid the protests. Follow us on Facebook, or on Twitter @BBCNewsEnts. If you have a story suggestion email entertainment.news@bbc.co.uk. "
21,'I thought maybe I would die': S Korea's delivery drivers demand change,"Tue, 03 Nov 2020 00:01:16 GMT",https://www.bbc.co.uk/news/world-asia-54775719,,"It was an hour before sunrise, 21 hours into a shift, and Mr Kim had delivered more than 400 packages. The 36-year-old delivery driver had been working since 5am the previous day. He messaged a colleague, pleading to skip a round of parcel deliveries.  ""It's too much,"" he wrote. ""I just can't.""  Four days later, Mr Kim was dead. He is one of 14 workers in South Korea who union officials say died because of overwork - most of them delivery drivers.  The fates of the 14 drivers can not be directly linked to overwork, but their families described the causes of death as ""kwarosa"" - a Korean term used for sudden death due to heart failure or a stroke as a result of extreme hard work. Drivers in South Korea are struggling to cope with the sheer volume of online orders during the Covid-19 pandemic. As the packages have piled up, so has the pressure.  Can you work yourself to death?South Korea gaming: Death by overwork sparks calls for changeIs Japan's culture of overwork finally changing? One of the drivers who died was 27-year-old Jang Deok-jin, a former Taekwondo enthusiast who had lost 15kg (33lbs) after doing 18 months of night shifts, according to his family. Deok-jin came home from a night shift earlier this month at around six in the morning and headed for a shower. His father found him dead face down in the bathtub an hour later.  ""We loved that boy. When he said it was such hard work we told him it was ok to stop working, but he used to tell me that he had plans for his future,"" his father said. ""I am to blame for not discouraging him from working so hard and exploiting himself."" Mr Jang's anger took him to South Korea's National Assembly. In grief he fell to his knees and begged congressmen to look at the circumstances surrounding his son's death.  ""It is my son who died,"" he said. ""I am going to let the whole world know about it. I am going to get to the bottom of it."" Deok-jin's case, along with others, won the attention of President Moon Jae-in, who called for an overhaul of working conditions for delivery employees, saying they had suffered some of the worst hardships under the pandemic.  The pressure is particularly acute in South Korea, where home deliveries are expected in hours not days.  In August, South Korea's labour ministry stepped in and urged the country's major logistics companies to sign a declaration to ensure drivers got enough rest and did not have to work continuous overnight shifts. Three of the biggest firms, CJ Logistics, Coupang and Hanjin Transportation, all made public apologies over the deaths of workers.  CJ Logistics said it would add more drivers and ensure all couriers were signed up for industrial accident insurance. Coupang said it was hiring more people while admitting the step was ""not enough"". Hanjin Transportation pledged to reduce the workload for its staff.  But most contracts signed by the workers are with independent agents who act as middlemen, rather than with the company itself, leaving them outside the protection of labour law. Union leaders also said they had yet to see the promised increase in manpower at most depots. Around the developed world, delivery drivers are bearing the burden and the cost of the pandemic-induced new normal. The coronavirus has accelerated our love of internet shopping - each year, demand for delivered goods has increased by 10% in South Korea. This year, so far, it has increased by double that. No human interaction is needed when shopping online, but there are humans involved in the transaction.  I visited a warehouse depot the size of an aircraft hanger on the outskirts of Seoul last week, where several hundred workers for Lotte Global Logistics were on strike demanding better pay and conditions. Their rally cry was, ""We want to live"". Kim Duk-yeon, 48, hadn't told his family he was on the picket line, as they knew he could not afford to go a day without pay. ""Before I used to think this work was just hard, but this year especially with the increased shipping due to the coronavirus, the situation on the ground got a lot worse,"" he said. ""As I worked more and more I thought maybe I too would die."" As the union march made its way through the warehouse there was an incessant clatter from the conveyor belts which snaked around the building moving thousands of boxes and bags of all shapes and sizes. Hundreds of delivery vans were lined up in neat rows with very little space between them. The drivers have to sort their own packages before they can even get behind the wheel.  Duk-yeon gets to the depot around 6.30am and can be sorting and packing for four to five hours before he gets on the road. Filling the trucks is like a giant jigsaw puzzle - fitting smaller and larger boxes into the space. No package can be left behind. Drivers there said they are paid around 800 Korean won per parcel ($0.70, £0.50), and these days they deliver around 350 packages a day. Most also have to pay for the wages of workers who bring packages down to the floor of the warehouse, and they have to pay penalties if deliveries are late or lost. The day after I visited the depot, Lotte Global Logistics settled its dispute with the unions. The company also pledged to deploy a thousand more workers to sorting stations and abolish the penalty payments.  Shin Bok-sun, a 43-year-old mother of three, said she hoped one day the workload would be reduced enough that she could see her kids at night. ""We are under a lot of pressure. There are customers who order groceries and call incessantly to complain that they need to make lunch or dinner with their order,"" she said. ""If the delivery doesn't come the same day, customers will call and say, 'I need to wear this skirt to go out today. Why is it coming at midday?'""  There are some small signs the deaths of delivery worker deaths is having an impact on South Korean shoppers. In the windows of some apartments you can see notes which read, ""Dear deliveryman, it's okay to be late"". In my apartment block, people have started to meet our delivery man with hot coffee and some breakfast. And hashtags like #it_is_ok_to_be_late, #Thankyoudeliverymen and #weneedtostopthedeathofdeliverymen have trended on social media. The coronavirus pandemic is likely to be with us for some time, and may have altered our shopping habits in the long term. These small signs of appreciation for the delivery drivers may not substantially change the demands placed on them but the gestures are welcomed by drivers as they prepare for the long shift ahead. "
