,title,date,link,author,text
43,US Election 2020: When will we get a result and could it be contested?,"Mon, 02 Nov 2020 17:45:46 GMT",https://www.bbc.co.uk/news/election-us-2020-54096399,,"After polls close in the US presidential election, it could take days or even weeks to find out if Donald Trump or Joe Biden has won.  In this election, millions more Americans have been voting by post because of coronavirus, meaning a delay in counting all the votes is highly likely. The result is usually called on the night of election day, which this year is Tuesday 3 November. Different states stop voting at different times. The first polls close on the East Coast at 19:00 local time (00:00 GMT). This is followed by a running total of votes as they are reported in each state.  The full count is never completed on election night - but enough votes are usually in to confirm a winner.  A state is ""called"" by major US media outlets when they believe one candidate has an unbeatable lead.  But at this stage, when most but not all of the votes will have been counted, this is a projection, not the final result. How the electoral college worksA really simple guide to the US election US presidents are not decided by the national vote, but by winning enough states. The winner in each state takes a certain number of ""electoral votes"" based roughly on the size of its population.  To win the White House, 270 electoral votes are needed. In 2016, the election was called for Donald Trump at about 02:30 EST (07:30 GMT), after victory in Wisconsin put him over the 270. The coronavirus pandemic means more people than ever are voting early, either by post or in person. Postal votes typically take longer to count as they have to go through more steps to be verified, such as a signature and address check. Some states, such as Florida and Ohio, allow this process to start weeks before election day, so the votes are ready to be counted.  In these states, it may be possible to call a winner on election night, depending on how close the races are. But other states, such as Pennsylvania and Wisconsin, don't allow early votes to be processed until polling day.  These states could be crucial - and election officials have said counts could take days. Do postal ballots lead to voting fraud? The way certain states process votes is also likely to skew early counts:  In states that wait until election day to process postal votes, initial numbers are likely to favour President Trump as more Republicans are expected to vote in person on polling day and these votes will be quicker to countIn states that process early votes before election day, the initial numbers are expected to favour Mr Biden as more registered Democrats than Republicans have voted early This is why election officials have warned the early results may not provide the full picture.  There have been delays in other polls this year - the 23 states that had held election contests after mid-March had taken an average of four days to report nearly complete results, a Washington Post analysis found. About half of states will accept postal ballots that arrive after election day, as long as they are postmarked by 3 November, so some votes won't be counted until days after the election. There's also expected to be a rise in provisional ballots - votes cast by people who requested a postal ballot but decided to vote in person instead.  And these won't be included in the initial count, as they require checks to ensure people don't vote twice. Millions of people will still be turning up to vote on election day - but fewer polling stations than usual will be open partly because of coronavirus considerations, and concerns have been raised about worker shortages, meaning long queues are likely. Familiar problems such as faulty voting machines could also cause delays. Most ballots - paper or digital - are counted by machines. But poll workers need to check any paper ballots the machines fail to process. After polls close, the voting data will be transferred to a central election headquarters - a city hall or similar location.  Sometimes, this is done electronically. But elsewhere, memory devices holding the voting data must be physically delivered or the results read out over the phone. Once the vote tallies are delivered, they'll often start to show up on a state's official website.  In other cases, journalists are told the tallies by state election officials and report these results.  When enough votes have been tallied from across a state to determine an unbeatable lead, news organisations call a winning presidential candidate for that state.  These unofficial results are certified only weeks later, when confirmed by state officials. The final vote tallies can shift between the first count and these certified results but not drastically. The pandemic has already led to more than 300 election law cases in 44 states, according the Stanford-MIT healthy-elections project. And the presidential vote could see legal challenges over everything from identification requirements for postal voting to Covid-related changes to polling systems. President Trump says the election result could end up in the US Supreme Court.  In 2000, Democrat Al Gore lost Florida and the presidential election by 537 out of a total of almost six million votes.  And this was followed by a highly controversial recount process that lasted over a month - and the Supreme Court ruling in favour of Republican George W Bush. How is Donald Trump doing in the polls?Has Trump delivered on his promises?What Joe Biden wants to doWhere does Donald Trump stand on key issues? "
44,US election 2020: A really simple guide,"Wed, 28 Oct 2020 23:48:26 GMT",https://www.bbc.co.uk/news/election-us-2020-53785985,,"If you cannot see the interactive content above click here Written and produced by Mike Hills, Evisa Terziu and Prina Shah.  What questions do you have about the US election? The US election process can be confusing. The BBC has been helping make sense of it by answering a range of your questions. You can send us more questions below. If you can't see the form, you may need to view the site on a desktop. In some cases, your question will be published, displaying your name, age and location as you provide it, unless you state otherwise. Your contact details will never be published. Please ensure you have read our terms & conditions and privacy policy. "
45,US election 2020 polls: Who is ahead - Trump or Biden?,"Mon, 02 Nov 2020 22:06:01 GMT",https://www.bbc.co.uk/news/election-us-2020-53657174,,"Voters in America will decide on 3 November whether Donald Trump remains in the White House for another four years. The Republican president is being challenged by Democratic Party nominee Joe Biden, who is best known as Barack Obama's vice-president but has been in US politics since the 1970s.  As election day approaches, polling companies will be trying to gauge the mood of the nation by asking voters which candidate they prefer.  We'll be keeping track of those polls here and trying to work out what they can and can't tell us about who will win the election.  National polls are a good guide as to how popular a candidate is across the country as a whole, but they're not necessarily a good way to predict the result of the election.  In 2016, for example, Hillary Clinton led in the polls and won nearly three million more votes than Donald Trump, but she still lost - that's because the US uses an electoral college system, so winning the most votes doesn't always win you the election.  With that caveat aside, Joe Biden has been ahead of Donald Trump in most national polls since the start of the year. He has hovered around 50% in recent months and has had a 10-point lead on occasions.  By contrast, in 2016 the polls were far less clear and just a couple of percentage points separated Mr Trump and his rival in the days before the election.   A really simple guide to the US electionHow will early voting impact the election? As Mrs Clinton discovered in 2016, the number of votes you win is less important than where you win them.   Most states nearly always vote the same way, meaning that in reality there are just a handful of states where both candidates stand a chance of winning. These are the places where the election will be won and lost and are known as battleground states.  In the electoral college system the US uses to elect its president, each state is given a number of votes based on how many members it sends to Congress - House and Senate. A total of 538 electoral college votes are up for grabs, so a candidate needs to hit 270 to win.  As the map above shows, some battleground states have a lot more electoral college votes on offer than others so candidates often spend a lot more time campaigning in them.  What is the electoral college?Predict the president: Play our game At the moment, polls in the battleground states look good for Joe Biden - although the margins have tightened in recent days. Mr Biden appears to have decent leads in Michigan, Pennsylvania and Wisconsin - three industrial states his Republican rival won by margins of less than 1% to clinch victory in 2016.  But it's the battleground states where Mr Trump won big in 2016 that his campaign team will be most worried about. His winning margin in Iowa, Ohio and Texas was between 8-10% back then but it's currently looking much closer in all three.  That's one of the reasons why some political analysts rate his chances of re-election as low as things stand.  The Economist thinks Mr Biden is ""very likely"" to beat Mr Trump while FiveThirtyEight, a political analysis website, sees Mr Biden as ""favoured"" to win the election but says the president could still come out on top.   How to follow the results on the BBCWhat has Trump said about your country? Donald Trump and Joe Biden went head-to-head in two live TV debates. The first, on 29 September, was a chaotic affair, with Mr Trump's combative approach stamping out any chance of a real debate.  A CBS News/YouGov poll taken straight afterwards suggested it was a good night for Mr Biden.  Of those who watched, 48% said Mr Biden was the winner while 41% went for Mr Trump - a similar split to national polling averages. Nearly 70% of people said the debate made them feel ""annoyed"".  In the second debate, on 22 October, organisers introduced a mute button to help police the arguments.  But it was a much more restrained President Trump on show and there was a much greater focus on the policies of the two candidates.  While that seemed to help Mr Trump somewhat, snap polls still suggested viewers thought Mr Biden's performance was more impressive.  A CNN poll found 53% of viewers thought the Democrat had done a better job in the debate, while 39% went with Mr Trump.  A YouGov snap poll was similar, with 54% saying Mr Biden had won compared to 35% for the president.  So while Mr Trump put in a better performance, it's unlikely to have been enough to change the balance of the race on its own.  Key takeaways from the Trump-Biden showdown We only had a couple of days to mull over the first debate before President Trump's bombshell tweet in the early hours of 2 October revealed he and the first lady had tested positive for coronavirus.  While the pandemic has dominated headlines in the US since the start of the year, the focus had shifted to the Supreme Court after the death of long-serving Justice Ruth Bader Ginsburg in September.  So Mr Trump's positive coronavirus test put his response to the pandemic, which has claimed the lives of more than 230,000 people in the US, back under the spotlight.  According to data from an ABC News/Ipsos poll, just 35% of Americans approve of how the president has handled the crisis. That figure climbs among Republicans, but only to 76%.  On his own health, 72% of respondents said that Mr Trump did not take the ""risk of contracting the virus seriously enough,"" while the same number said he failed to take ""the appropriate precautions when it came to his personal health"". A similar Yahoo News/YouGov poll found that about half of respondents believed he could have avoided contracting the disease altogether if he had practised greater social distancing and worn a face mask.  Why are Covid-19 infections rising again in US? It's easy to dismiss the polls by saying they got it wrong in 2016 and President Trump frequently does exactly that. But it's not entirely true.  Most national polls did have Hillary Clinton ahead by a few percentage points, but that doesn't mean they were wrong, since she won three million more votes than her rival. Pollsters did have some problems in 2016 - notably a failure to properly represent voters without a college degree - meaning Mr Trump's advantage in some key battleground states wasn't spotted until late in the race, if at all. Most polling companies have corrected this now. But this year there's even more uncertainty than normal due to the coronavirus pandemic and the effect it's having on both the economy and how people will vote in November, so all polls should be read with some scepticism.  Could postal voting upend the US election?Americast: The latest news and gossip from the campaign trail What questions do you have about the US election? The US election process can be confusing. The BBC is here to help make sense of it. Please put your questions below. If you can't see the form, you may need to view the site on a desktop. In some cases, your question will be published, displaying your name, age and location as you provide it, unless you state otherwise. Your contact details will never be published. Please ensure you have read our terms & conditions and privacy policy. Written and produced by Mike Hills and Will Dahlgreen. Design by Irene de la Torre Arenas. Development by Katie Hassell, Marcos Gurgel, Steven Connor and Shilpa Saraf.  "
46,Predict the president 2020: Will Trump or Biden win the US election? You decide,"Fri, 25 Sep 2020 16:35:15 GMT",https://www.bbc.co.uk/news/election-us-2020-54286528,,"This year's US presidential election could come down to results in just a few key states. Most states are tipped to vote one way or another - so we have already assigned 188 votes to Mr Trump and 233 to Mr Biden. Can Joe Biden wrestle enough away to seize the presidency? Or will Donald Trump romp home to a second term? It's all about the race to 270 electoral votes - and this time you decide. Click here if you can't see the interactive In the US election system, it's the state-level results that count. Each state has a number of electoral votes, based on population, and many reliably vote the same way each time. Two independent American sources, Real Clear Politics and The Cook Political Report, publish lists of states grouped by how they are expected to vote on election night. Several states are classified as ""toss-ups"", which means they could be won by either side. We chose our seven key states from those toss-ups which have enough electoral votes to sway the final outcome and where we expect the battle to be fought most closely. President Trump won all of them in 2016 Since most states are already tipped to vote one way or another, we've assigned their respective electoral votes to the candidate that each is considered most likely to vote for. This means the game starts at 188 votes for Mr Trump and 233 for Mr Biden. Technically, yes. There are a total of 538 electoral college votes and it is possible for two candidates to win states in such a way that each will come out with 269 votes. Awkward. It's also possible for no candidate to receive a majority. To determine a single winner, the US House of Representatives will vote for the next president and the US Senate will vote for the next vice-president. This is so rare, though, that it's only happened a few times in US history… and not since the 19th Century. Written and produced by Harriet Agerholm, Becky Dale, Evisa Terziu and Sean Willmott The US election process can be confusing. The BBC is here to help make sense of it. Please put your questions below. If you can't see the form, you may need to view the site on a desktop. In some cases, your question will be published, displaying your name, age and location as you provide it, unless you state otherwise. Your contact details will never be published. Please ensure you have read our terms & conditions and privacy policy. "
47,US election 2020: What are Trump's and Biden's policies?,"Sun, 18 Oct 2020 15:14:28 GMT",https://www.bbc.co.uk/news/election-us-2020-54507550,,"American voters will face a clear choice for president on election day, between Republican incumbent Donald Trump and Democratic hopeful Joe Biden. Here's a look at what they stand for and how their policies compare on eight key issues. President Trump set up a coronavirus task force at the end of January which he says has now shifted its focus to ""safety and opening up our country"". The president is also prioritising the speedy development of coronavirus treatments and vaccines, directing $10bn towards such projects. Mr Biden wants to set up a national contact-tracing programme, establish at least 10 testing centres in every state, and provide free coronavirus testing to all. He supports a nationwide mask mandate, which would require face coverings to be worn on federal property. A simple guide to the US election President Trump is a climate change sceptic, and wants to expand non-renewable energy. He aims to increase drilling for oil and gas, and roll back further environmental protections. He has committed to withdrawing from the Paris Climate Accord - the international agreement on tackling climate change - which the US will formally leave later this year. Mr Biden says he would immediately re-join the Paris climate agreement if elected. He wants the US to reach net zero emissions by 2050, and proposes banning new leases for oil and gas drilling on public lands, as well as a $2tn investment in green energy. How election could decide battle against climate change President Trump has pledged to create 10 million jobs in 10 months, and create one million new small businesses. He wants to deliver an income tax cut, and provide companies with tax credits to incentivise them to keep jobs in the US. Mr Biden wants to raise taxes for high earners to pay for investment in public services, but says the increase will only impact those earning over $400,000 a year. He supports raising the federal minimum wage to $15 (£11.50) an hour from the current rate of $7.25 (£5.50). Trump economy in six charts President Trump wants to repeal the Affordable Care Act (ACA) passed under President Obama, which increased the federal government's regulation of the private health insurance system, including making it illegal to deny coverage for people with pre-existing medical conditions. He says he wants to improve and replace it, although no details of the plan have been published. The president also aims to lower drug prices by allowing imports of cheaper ones from abroad. Mr Biden wants to protect and expand the ACA. He wants to lower the eligibility age for Medicare, the policy which provides medical benefits to the elderly, from 65 to 60. He also wants to give all Americans the option to enrol in a public health insurance plan similar to Medicare. Four lives depending on 'Obamacare' President Trump has reiterated his promise to bring down US troop levels overseas, while continuing to invest in the military. The president says he will continue to challenge international alliances and maintain trade tariffs on China. Mr Biden has promised to repair relationships with US allies. He says he would do away with unilateral tariffs on China, and instead hold them accountable with an international coalition that China ""can't afford to ignore"". How would Biden change US foreign policy? President Trump says he doesn't believe racism is a systemic problem within US police forces. He has positioned himself as a firm advocate of law enforcement, but has opposed chokeholds and offered grants for improved practices. Mr Biden views racism as a systemic problem, and has set out policies to address racial disparities in the justice system, such as grants to incentivise states in reducing incarceration rates. He has rejected calls to defund police, saying additional resources should instead be tied to maintaining proper standards. Seven solutions to US police problems      President Trump has an expansive interpretation of the US constitution's Second Amendment protections giving Americans the right to bear arms. He did propose tightening background checks on gun buyers after a string of mass shootings in 2019, but nothing came of the plan and no further legislation has been put forward. Mr Biden has proposed banning assault weapons, universal background checks, limiting the number of guns a person can purchase to one per month, and making it easier to sue negligent gun manufacturers and sellers. He would also fund more research into preventing gun violence. How is Donald Trump doing in the polls? President Trump says it's his constitutional right to fill the vacancy on the court during the remainder of his first term in office, and has put forward conservative judge, Amy Coney Barrett. One issue that the Supreme Court could soon rule on is the legal right to abortion in the US - something the president and Judge Barrett have opposed in the past. Mr Biden wants the vacancy to be filled after the next president enters office. He says if elected he would work to pass legislation to guarantee a woman's right to an abortion if the Supreme Court rules against it. What is the US Supreme Court? Who will be the next US president? You decideWhy we might not get a result on election nightHas Trump delivered on his promises?Full coverage of the US election "
